http://www.baomoi.com/Quy-mo-doanh-nghiep-dang-nho-di/45/13513590.epi	2014/04/08 05:03:20	2014/04/08 03:36:00	{"abstract":"(HQ Online)- Sáng 8-4, Phòng Thương mại và Công nghiệp Việt Nam (VCCI) công bố Báo cáo thường niên doanh nghiệp (DN) Việt Nam 2013 với chủ đề Phát triển DN và chất lượng tăng trưởng.","category":"http://www.baomoi.com/Home/KinhTe.epi","content":"Lễ công bố thu hút sự tham dự của nhiều chuyên gia và DN. \u003Cstrong\u003EXu hướng báo động\u003C/strong\u003E\n Theo Báo cáo thường niên DN Việt Nam 2013, quy mô bình quân của DN đang có xu hướng nhỏ đi. Nếu tính theo tiêu chí lao động, giai đoạn năm 2007-2011, lao động bình quân trong DN đã giảm từ 47 xuống còn 34 và xuống tiếp còn 32 vào năm 2012, tương ứng với quy mô của DN nhỏ. Điều này phù hợp với thực tế là tỷ trọng DN nhỏ và siêu nhỏ trong nền kinh tế ngày càng tăng và nguy cơ Việt Nam thiếu các DN cỡ trung bình đã trở thành hiện hữu. Số lượng DN có quy mô vừa hiện chỉ chiếm 1,96%. Tỷ lệ DN lớn cũng chỉ chiếm 2,25%.\n Theo phân tích, sự suy giảm quy mô lao động bình quân của DN bắt nguồn từ sự suy giảm quy mô bình quân của khu vực DN ngoài Nhà nước, loại hình DN vốn chiếm tỷ trọng rất cao trong nền kinh tế. Quy mô bình quân của loại hình DN này đã giảm từ 27 lao động năm 2007 xuống còn 21 lao động năm 2012. Đây là một điểm đáng lưu ý đối với các nhà hoạch định chính sách cần có thêm những chính sách hỗ trợ các DN nhỏ và siêu nhỏ bởi trong thời gian qua, loại hình DN này chưa được quan tâm đúng mức. \n Quy mô của DN nếu được tính theo quy mô vốn cũng ghi nhận có sự suy giảm trong năm 2012. Đây cũng là lần đầu tiên quy mô vốn bình quân của DN giảm trong vòng 10 năm trở lại đây. Nguyên nhân của vấn đề này được báo cáo nhận định là do quy mô vốn bình quân của DN ngoài Nhà nước giảm mạnh. Việc quy mô vốn của khu vực DN ngoài Nhà nước cho thấy thực trạng khó khăn của DN trong năm 2012. \n Trao đổi về vấn đề này, Tổng Thư ký VCCI Phạm Thị Thu Hằng cho rằng: Chúng ta đang cần những DN có quy mô lớn và trung bình để có đủ khả năng đáp ứng hiệu quả sản xuất kinh doanh. Tuy nhiên để tạo ra năng suất lao động cao, ứng dụng công nghệ mới, đặc biệt để xuất khẩu hay tham gia vào những chuỗi cung ứng toàn cầu thì ta cần có những DN có quy mô vừa. \n Bà Phạm Thị Thu Hằng cũng cảnh báo: Đây là một vấn đề đáng báo động khi trong báo cáo của VCCI năm 2012 đã thống kê từ năm 2002 đến năm 2011 cho thấy 2/3 DN Việt Nam không thể lớn được, nếu không muốn nói là đang dần nhỏ đi và “biến mất”. \n \u003Cstrong\u003ELạc quan trong sản xuất kinh doanh\u003C/strong\u003E\n Về tình hình kinh tế vĩ mô, báo cáo nhận định, một số yếu tố được DN dự cảm vào cuối năm 2012 khá sát so với thực tế diễn ra vào năm 2013. Điển hình là các yếu tố về nhu cầu thị trường trong nước, tiếp cận thị trường công nghệ, điều kiện hạ tầng giao thông và yếu tố về cấp đất, giải phóng mặt bằng mở rộng sản xuất. Bên cạnh đó, một số yếu tố được DN dự cảm sẽ tốt lên trong năm 2013 nhưng thực tế năm 2013 vẫn chưa được cải thiện, ví dụ nhu cầu thị trường trong nước và tiếp cận vốn vay. \n Về chính sách hỗ trợ tiếp cận vốn cho DN, trong năm 2013, 65,2% DN trong diện điều tra có nhu cầu vay vốn ngân hàng, trong khi tỷ lệ này năm 2012 là 57,3%. Như vậy, nhu cầu vay vốn ngân hàng của DN có xu hướng tăng so với năm 2012. Có 34,8% DN không có nhu cầu vay vốn. Trong những DN không vay vốn, 40,5% lượt nêu lý do vì lãi suất vẫn cao, kinh doanh không đủ hiệu quả để trả lãi; 21,1% do thị trường tiêu thụ sản phẩm bị thu hẹp; 18,6% do đã tìm được kênh huy động vốn khác, 19,1% do nguyên nhân khác.\n Theo kết quả điều tra, nhiều DN có kế hoạch giữ nguyên quy mô kinh doanh trong năm 2014. Tỷ lệ này chiếm 50,7%. 42,5% DN được khảo sát có thể mở rộng quy mô kinh doanh và 6,7% có thể giảm quy mô kinh doanh, chỉ có 0,1% DN có thể sẽ phải tạm dừng hoạt động.\n DN quyết định mở rộng quy mô sản xuất kinh doanh là do nhiều yếu tố khác nhau. Trong đó, nhóm nguyên nhân triển vọng kinh tế thuận lợi và sẵn có lao động có tay nghề với chi phí cạnh tranh cao được nhiều lượt DN lựa chọn nhất. Tỷ lệ này lần lượt là 42,9% và 40,1%. DN đang kỳ vọng rất nhiều vào những chuyển biến tại thị trường lao động vì đây là thời điểm dễ dàng nhất để DN có thể tuyển dụng được nhân lực đáp ứng ngay được yêu cầu công việc mà có thể không nhất thiết phải đào tạo, thậm chí với cả những vị trí chủ chốt. \n \u003Cstrong\u003EThiết lập cơ cấu kinh tế ngành\u003C/strong\u003E\n Tuy nhiên, để hỗ trợ DN hoạt động tốt hơn trong năm 2014 và thời gian tiếp theo, các chuyên gia tại lễ công bố đã nêu một số khuyến nghị đối với cơ chế chính sách và đối với DN. Theo bà Phạm Thị Thu Hằng, cần thiết lập cơ cấu kinh tế ngành, vùng phù hợp, phục vụ mục tiêu hiệu quả kinh doanh và phát triển lợi thế cạnh tranh của từng địa phương và của quốc gia. Để làm được việc này, các trọng tâm về tái cơ cấu các tổ chức tín dụng mà Chính phủ đang theo đuổi phải được thực hiện đồng bộ và nhất quán. \n Ngoài ra, cần tăng hàm lượng khoa học công nghệ và tỷ trọng giá trị nội địa trong sản phẩm thông qua đầu tư đổi mới công nghệ, chuyển giao kiến thức, thu hút FDI, lựa chọn một số ngành có lợi thế cạnh tranh để ưu tiên phát triển, tập trung phát triển một số DN có hiệu quả kinh doanh, có quy mô từ cỡ trung bình trở lên.\n Theo ông Trương Đình Tuyển, thành viên Ban tư vấn của Thủ tướng Chính phủ, còn cần phát triển DN gắn với đổi mới mô hình tăng trưởng, xây dựng môi trường kinh doanh thuận lợi, bình đẳng, phát triển nguồn lực về nhân lực chất lượng cao…\n Về phía DN, các chuyên gia khuyến cáo cần quan tâm và thường xuyên cập nhật các chính sách của Chính phủ để tận dụng sự hỗ trợ, tiếp tục thực hiện mạnh mẽ quá trình tái cấu trúc DN, tăng cường năng lực hấp thụ vốn đầu tư bằng chiến lược kinh doanh, chú trọng việc cân đối dòng tiền, xây dựng, rà soát và có cơ chế giám sát chặt chẽ hệ thống các định mức chi phí trong quá trình sản xuất, kinh doanh. \n \u003Cstrong\u003EAn Tư\u003C/strong\u003E\n \n","crawl":1396951400128,"crawler":"news-1y-v1","htmlenc":"true","img_urls":[{"description":"","url":"http://www.baohaiquan.vn/images/2014/4/hohue/congbobc-5153a.jpg"}],"isoLanguageCode":"vn","media":"news","pub":1396946160000,"region":"vn","source_url":"Báo Hải Quan","tags":["quy mô","Phòng Thương mại và Công nghiệp VN","vay vốn","sản xuất kinh doanh","tỷ trọng","kinh doanh","báo cáo","chính sách","suy giảm","yếu tố","Hàn Quốc","online","doanh nghiệp Việt Nam","kinh tế vĩ mô","thị trường trong nước"],"title":"Quy mô doanh nghiệp đang nhỏ đi","url":"http://www.baomoi.com/Quy-mo-doanh-nghiep-dang-nho-di/45/13513590.epi","valid":"true"}
http://www.baomoi.com/Maritime-Bank-trinh-DHCD-sap-nhap-1-to-chuc-tin-dung-khac/126/13513852.epi	2014/04/08 05:03:20	2014/04/08 03:36:00	{"abstract":"Nội dung này được dự kiến trình ĐHCĐ của ngân hàng thông qua.","category":"http://www.baomoi.com/Home/KinhTe.epi","content":"Ngân hàng TMCP Hàng Hải Việt Nam (Maritime Bank - MSB) vừa công bố tờ trình đại hội cổ đông năm 2014 thông qua việc sáp nhập một tổ chức tín dụng khác vào MSB. \n \nỦy quyền cho Hội đồng Quản trị MSB chủ động phê duyệt, điều chỉnh, sửa đổi, bổ sung các nội dung tại Đề án sáp nhập, Hợp đồng sáp nhập, Điều lệ ngân hàng sau sáp nhập và Phương án phát hành cổ phiếu ra công chúng để hoán đổi cổ phần và các tài liệu hồ sơ có liên quan khác theo yêu cầu của các cơ quan quản lý Nhà nước có thẩm quyền mà không cần phải lấy ý kiến của ĐHCĐ. \n \nỦy quyền cho HĐQT triển khai thực hiện tất cả các thủ tục cần thiết, ký các văn bản và xử lý tất cả các vấn đề phát sinh có liên quan tới việc sáp nhập. \n","crawl":1396951400128,"crawler":"news-1y-v1","htmlenc":"true","img_urls":[],"isoLanguageCode":"vn","media":"news","pub":1396946160000,"region":"vn","source_url":"Gafin.vn","tags":["MaritimeBank","sáp nhập","đại hội cổ đông","tổ chức tín dụng","ủy quyền","hội đồng quản trị","ngân hàng","hoán đổi","phát hành cổ phiếu","tờ trình","lấy ý kiến"],"title":"Maritime Bank trình ĐHCĐ sáp nhập 1 tổ chức tín dụng khác","url":"http://www.baomoi.com/Maritime-Bank-trinh-DHCD-sap-nhap-1-to-chuc-tin-dung-khac/126/13513852.epi","valid":"true"}
http://www.baomoi.com/Vang-chau-A-tang-nhung-van-duoi-nguong-1300-USD/126/13513714.epi	2014/04/08 05:03:20	2014/04/08 03:36:00	{"abstract":"Trong phiên ngày 8/4, giá vàng tại châu Á nhích nhẹ sau khi sụt giảm mạnh trong phiên trước, nhờ thị trường chứng khoán suy yếu đã làm tăng sức hấp dẫn của vàng, vốn được coi là nơi trú ẩn an toàn.","category":"http://www.baomoi.com/Home/KinhTe.epi","content":"Trang sức bằng vàng tại một cửa hàng kim hoàn ở Singapore. (Nguồn: AFP/TTXVN) \n \n \n Vào lúc 7 giờ 26 phút (giờ Việt Nam), trên sàn giao dịch điện tử Singapore, giá vàng giao ngay tăng 0,2% lên 1.298,11 USD/ounce. \n \n Giá kim loại quý này đã giảm 0,5% trong phiên giao dịch trước dù có một đợt tăng ngắn theo sau báo cáo việc làm trong lĩnh vực phi nông nghiệp của Mỹ không như mong đợi của thị trường. \n \n Phiên trước (7/4), giá vàng tại Mỹ giảm do thiếu nhu cầu đầu tư sau đợt tăng giá khá mạnh hôm 4/4 khi số liệu việc làm của Mỹ không được như mong đợi. Chốt phiên này, giá vàng kỳ hạn giao tháng Tư đã giảm 5,2 USD, đứng ở mức 1.298,30 USD/ounce. \n \n Nhà đầu tư đã bán ra chốt lời sau khi cuối tuần trước giá vàng tăng hơn 1%, mức tăng lớn nhất trong một phiên trong ba tuần qua. \n \n Theo công bố của Bộ Lao động Mỹ, tháng trước khu vực phi nông nghiệp của nước này có thêm 192.000 việc làm, thấp hơn so với mức dự báo tăng 200.000 việc làm. \n \n Tâm lý của các nhà đầu tư vẫn còn khá ảm đạm, khi SPDR Gold Trust, quỹ giao dịch vàng lớn nhất thế giới cho biết lượng vàng do quỹ này nắm giữ đã giảm 1,8 tấn xuống còn 809,18 tấn./. \n","crawl":1396951400128,"crawler":"news-1y-v1","htmlenc":"true","img_urls":[{"description":"","url":"http://img1.vietnamplus.vn/t660/Uploaded/rotnhz/2014_04_08/giavang.jpg"}],"isoLanguageCode":"vn","media":"news","pub":1396946160000,"region":"vn","source_url":"Vietnam Plus","tags":["giá vàng","phi nông nghiệp","việc làm","SPDR","vàng","mong đợi","chốt lời","USD","Singapore","kim hoàn","nhà đầu tư","Châu Á","thị trường chứng khoán","AFP","Thông Tấn Xã Việt Nam"],"title":"Vàng châu Á tăng nhưng vẫn dưới ngưỡng 1.300 USD","url":"http://www.baomoi.com/Vang-chau-A-tang-nhung-van-duoi-nguong-1300-USD/126/13513714.epi","valid":"true"}
http://www.baomoi.com/TCTD-nao-se-sap-nhap-vao-Maritimebank/126/13513749.epi	2014/04/08 05:03:20	2014/04/08 03:36:00	{"abstract":"Ngân hàng TMCP Hàng Hải – Maritimebank (MSB) sẽ trình cổ đông thông qua việc sáp nhập một TCTD khác vào Maritimebank nhưng không công bố chi tiết là tổ chức nào.","category":"http://www.baomoi.com/Home/KinhTe.epi","content":"* Maritimebank: Năm 2013 lãi chứng khoán đầu tư bằng ½ thu nhập lãi thuần \n HĐQT cũng trình ĐHĐCĐ ủy quyền chủ động phê duyệt các nội dung tại Đề án sáp nhập, Hợp đồng sáp nhập, Điều lệ ngân hàng sau sáp nhập và phương án phát hành cổ phiếu để hoán đổi cổ phần và các tài liệu liên quan.\n Về kế hoạch kinh doanh năm 2014, Maritimebank đặt chỉ tiêu tổng tài sản tăng 5% lên 111,920 tỷ đồng. Huy động và dư nợ dự kiến tăng 22% và 13% lên 83,600 tỷ và 51,700 tỷ đồng. Tỷ lệ nợ xấu dưới 3%.\n Lợi nhuận trước thuế (bao gồm cả phần thu hồi nợ đã sử dụng dự phòng) dự kiến đạt 265 tỷ đồng, giảm 34% so với thực hiện năm 2013 (401 tỷ đồng). Thù lao và chi phí HĐQT cùng BKS sẽ trình cổ đông là 13 tỷ cho năm 2013 và 15 tỷ đồng cho năm 2014. Ngân hàng sẽ không chia cổ tức cho cả hai năm 2013-2014. \n Minh Hằng\n công lý\n\n","crawl":1396951400128,"crawler":"news-1y-v1","htmlenc":"true","img_urls":[],"isoLanguageCode":"vn","media":"news","pub":1396946160000,"region":"vn","source_url":"Vietstock","tags":["MaritimeBank","sáp nhập","hội đồng quản trị","cổ đông","lãi","chứng khoán đầu tư","Minh Hằng","nợ xấu","lợi nhuận trước thuế","dư nợ","ngân hàng","đại hội cổ đông","phát hành cổ phiếu","kế hoạch kinh doanh","cổ tức"],"title":"TCTD nào sẽ sáp nhập vào Maritimebank?","url":"http://www.baomoi.com/TCTD-nao-se-sap-nhap-vao-Maritimebank/126/13513749.epi","valid":"true"}
http://www.baomoi.com/Vi-sao-khong-nen-qua-tu-te-trong-cong-viec/146/13513676.epi	2014/04/08 05:03:20	2014/04/08 03:34:00	{"abstract":"BizLIVE - Hãy tốt bụng, tử tế với nhân viên của bạn, nhưng đừng để điều đó khiến bạn trở nên dễ dãi và thiếu trách nhiệm.","category":"http://www.baomoi.com/Home/KinhTe.epi","content":"Là lãnh đạo, tốt bụng nhưng cũng cần phải quyết đoán.\n Bạn sẽ phản ứng thế nào khi một nhân viên đề xuất một ý tưởng tồi trong cuộc họp? Bạn gật đầu và cố gắng động viên anh ta/cô ta và nói nước đôi: “Ồ, cũng được đấy. Có thể tôi sẽ xem xét”, hay bạn thật thà nói rằng: “Đó không phải là hướng đi mà chúng ta nhắm đến, nhưng dù sao cũng cảm ơn cậu”.\n Là một lãnh đạo quá dễ dãi thực sự sẽ làm hại bạn, lãng phí thời gian, nguồn lực và có thể phá hỏng uy tín của bạn trong con mắt khách hàng và những nhân viên mẫn cán, Michael Fertik, sáng lập gia trang Reputation.com, một công ty tư vấn trực tuyến về danh tiếng cá nhân và doanh nghiệp, chia sẻ.\n “Các nhà lãnh đạo thường chịu áp lực rất lớn để phải cư xử quảng đại, thân thiện và tốt bụng. Bạn có thể nhìn thấy những cái lợi của điều này, bởi sẽ dễ chịu hơn rất nhiều khi được nhiều người yêu mến, chẳng có ai lại không muốn người khác yêu mến mình”, Fertik viết trên Harvard Business Review. “Nhưng các lãnh đạo cũng được kỳ vọng phải đưa ra được những quyết định quan trọng mang lại lợi ích cao nhất cho công ty. Quá dễ dãi có thể khiến nhân viên của họ lười biếng, làm việc kém hiệu quả, thiếu trách nhiệm và như vậy phương hại đến công ty.”\n Rõ ràng là ở đây có sự phân vân giữa việc là một CEO tốt bụng, tử tế hay một CEO quyết đoán. Có một cách để cân bằng hai xu hướng này, Đó là: “Tốt bụng chỉ tốt khi nó đi đôi với một khả năng suy xét hợp lý và ra quyết định sáng suốt trong những thời điểm khó khăn”, Fertik nói.\n Tham khảo các tình huống dưới đây và áp dụng lời khuyên của Fertik để có những quyết định đúng đắn cho mình thay vì chỉ “tốt bụng” và “tử tế” với mọi người.\n \u003Cstrong\u003EKhông giữ một nhân viên không phù hợp\u003C/strong\u003E\n Nếu bạn đã tuyển một nhân viên không phù hợp, đừng cố gắng giữ lại anh ta. Nếu người nhân viên bạn mới tuyển thực sự là một sai lầm, đừng hy vọng sẽ cải tạo hay huấn luyện được anh ta. Fertik nói, bạn cần quyết đoán và sa thải anh ta ngay. “Làm ngược lại có nguy cơ dẫn đến một sự đối đầu kéo dài, dù đúng là bạn hy vọng mọi chuyện sẽ tốt hơn. Sẽ chẳng có lợi gì khi để người đó lúng túng không biết xử trí ra sao, nhất là khi anh ta hoặc cô ta không cảm thấy toại nguyện”, Fertik viết. “Hãy nói chuyện nghiêm túc và rõ ràng, chứ không phải là tỏ ra tốt bụng. Hãy dũng cảm để loại bỏ họ, giúp người đó chuyển đến một nơi mà anh ta hay cô ta có thể thành công. Quản lý nhân sự sẽ rất có lợi cho năng suất lao động và nền tảng văn hóa của bạn. Theo thời gian, bạn sẽ thu hút được những nhân viên có giá trị và đủ sức thuyết phục.\n \u003Cstrong\u003EĐừng khoan dung\u003C/strong\u003E\n Là một lãnh đạo, quá tốt bụng với tất cả mọi thứ, bạn sẽ chuốc vạ vào thân cũng như cho công ty của bạn. “Khi bạn tỏ ra quá tốt bụng với các nhà cung cấp, có thể họ sẽ lừng khừng giao hàng không đúng hẹn, với đồng nghiệp, có thể họ chểnh mảng công việc, với khách hàng, có thể họ lơ là thanh toán – nghĩa là bạn thực sự để cho người khác lợi dụng mình và công ty của mình”, Fertik nói. Nếu bạn cứ dễ dãi với người này, người kia và để họ tự do lạm dụng, bạn đang gieo mầm cho sự “coi thường” và “thiếu tôn trọng”. Hãy thử tưởng tượng phản ứng của những nhân viên tài năng nhất, tâm huyết và mẫn cán nhất của bạn khi họ cứ lần này đến lần khác phải chứng kiến các đồng nghiệp lười biếng bày trò lừa gạt. Tức giận tích tụ, tinh thần giảm sút, và doanh thu thì đi lên một cách gian dối. “Bạn không cần phải thật khó tính để đòi hỏi được tôn trọng, nhưng bạn cần đảm bảo công ty của mình phải đạt được một tiêu chuẩn nào đó – và bạn cần phải chắc chắn về những người giúp bạn có được điều này. Đặt ra các nguyên tắc sẽ hỗ trợ bạn đắc lực khi bạn cần hành động dứt khoát. Không trì hoãn, không do dự, không tranh cãi. Bạn nhớ nhé.”\n \u003Cstrong\u003EDành thời gian để tự vấn\u003C/strong\u003E\n Nếu bạn có thói quen dễ dãi với nhân viên, bạn cũng có khả năng để điều đó xảy ra với mình. “Tự vấn là một công cụ rất hữu hiệu dành cho lãnh đạo mà chúng ta thường hay bỏ quên. Khi bạn tự hỏi điều gì khiến bạn và công ty của bạn tụt lại sau, bạn có thể cải thiện được khả năng lãnh đạo của mình”, Fertik viết trong Harvard Business Review. “Khi bạn cho nhân viên của mình cơ hội để họ chia sẻ những sự thật khó nói, mà không phải e ngại hậu quả, bạn đang mở ra những triển vọng mới cũng như bước nhảy vọt trên con đường trở thành một lãnh đạo được nhân viên “tâm phục, khẩu phục”.\n Theo Business Insider\n \n","crawl":1396951400128,"crawler":"news-1y-v1","htmlenc":"true","img_urls":[{"description":"","url":"http://bizlive.vn/Uploaded/camthinh76/2014_04_08/Nice_FPAI.jpg?width=670&height=350&crop=auto"}],"isoLanguageCode":"vn","media":"news","pub":1396946040000,"region":"vn","source_url":"BizLive","tags":["nhân viên","lãnh đạo","tự vấn","quyết đoán","Đại học Harvard","yêu mến","nhất tâm","tôn trọng","quá","bày trò","tụt lại","online","CEO","quản lý nhân sự"],"title":"Vì sao không nên quá “tử tế” trong công việc","url":"http://www.baomoi.com/Vi-sao-khong-nen-qua-tu-te-trong-cong-viec/146/13513676.epi","valid":"true"}
http://www.baomoi.com/TCL-Ke-hoach-lai-2014-gan-84-ty-dong-giam-nhe-so-voi-thuc-hien-2013/127/13513728.epi	2014/04/08 05:03:20	2014/04/08 03:31:00	{"abstract":"Congly.vn - ĐHĐCĐ của CTCP Đai lý Giao nhận Vận tải Xếp dỡ Tân Cảng (HOSE: TCL) thông qua kế hoạch năm 2014 với tổng doanh thu đạt 825.6 tỷ đồng, tăng 6.4% nhưng lợi nhuận sau thuế của công ty mẹ chỉ gần 84 tỷ đồng, giảm nhẹ so với con số 85.","category":"http://www.baomoi.com/Home/KinhTe.epi","content":"ĐHĐCĐ cũng thông qua kế hoạch đầu tư năm 2014, với gần 213.3 tỷ đồng cho đầu tư tại công ty mẹ (xây dựng cơ bản và thiết bị công nghệ), hơn 26.8 tỷ đồng tại công ty con.\n Triệu Linh\n\n","crawl":1396951400128,"crawler":"news-1y-v1","htmlenc":"true","img_urls":[],"isoLanguageCode":"vn","media":"news","pub":1396945860000,"region":"vn","source_url":"Báo Công Lý","tags":["TCL","công ty mẹ","đại hội cổ đông","giảm nhẹ","xếp dỡ","kế hoạch","xây dựng cơ bản","giao nhận","lợi nhuận sau thuế","công ty con","HOSE"],"title":"TCL: Kế hoạch lãi 2014 gần 84 tỷ đồng, giảm nhẹ so với thực hiện 2013","url":"http://www.baomoi.com/TCL-Ke-hoach-lai-2014-gan-84-ty-dong-giam-nhe-so-voi-thuc-hien-2013/127/13513728.epi","valid":"true"}
http://www.baomoi.com/BOJ-hoan-goi-kich-thich-kinh-te/126/13513898.epi	2014/04/08 05:03:20	2014/04/08 03:28:00	{"abstract":"Ngân hàng Trung Ương Nhật (BOJ) cho biết nền kinh tế lớn thứ ba thế giới có thể duy trì đà phục hồi bất chấp đợt tăng thuế tiêu dùng tuần trước.","category":"http://www.baomoi.com/Home/KinhTe.epi","content":"Trong tuyên bố ra ngày hôm nay, thống đốc Haruhiko Kuroda cho biết BOJ vẫn giữ cam kết tăng cơ số tiền tệ ở mức từ 60 nghìn tỷ Yên lên 70 nghìn tỷ Yên mỗi năm (tương đương 681 tỷ USD). \n \nTheo hãng tin Bloomberg, BOJ sẽ thêm gói kích thích vào tháng 7 nhằm đưa mức lạm phát về gần chỉ tiêu 2% và đẩy nền kinh tế tăng trưởng trước một đợt tăng thuế có thể diễn ra vào năm sau. \n \nKinh tế trưởng của NLI Research Institute tại Tokyo, ông Yasuhide Yajima dự báo nền kinh tế sẽ chững lại và giá cả sẽ không tăng nhiều từ tháng 4 đến tháng 6 do đợt tăng thuế mới, và BOJ sẽ có chính sách mở rộng trong khoảng tháng 5 đến tháng 7. \n \nĐồng Yên Nhật suy giảm sau thông báo của BOJ. Chỉ số cổ phiếu Topix sụt 1.6%. \n","crawl":1396951400128,"crawler":"news-1y-v1","htmlenc":"true","img_urls":[],"isoLanguageCode":"vn","media":"news","pub":1396945680000,"region":"vn","source_url":"Gafin.vn","tags":["thuế","nền kinh tế","Đồng yên Nhật","cơ số","gói kích thích kinh tế","Bloomberg","thống đốc","tiền tệ","lạm phát","suy giảm","hãng thông tấn","Nhật Bản","Tokyo"],"title":"BOJ hoãn gói kích thích kinh tế","url":"http://www.baomoi.com/BOJ-hoan-goi-kich-thich-kinh-te/126/13513898.epi","valid":"true"}
