http://www.baomoi.com/Hoat-dong-xuat-khau-lao-dong-trong-nam-2014-Nhung-tin-hieu-tich-cuc/47/13514473.epi	2014/04/08 05:03:20	2014/04/08 04:44:00	{"abstract":"QĐND - Ngay từ những tháng đầu năm 2014, một số thị trường truyền thống như: Nhật Bản, Đài Loan (Trung Quốc), Ma-lai-xi-a, Hàn Quốc, Đông Âu tiếp tục có nhu cầu tuyển lao động là người Việt Nam. Đây là một trong những tín hiệu vui cho hoạt động xuất khẩu lao động của nước ta. Hàng chục nghìn lao động Việt Nam sẽ có cơ hội ra nước ngoài làm việc và mục tiêu đưa 90.000 lao động đi làm việc ở nước ngoài trong năm 2014 mà Bộ Lao động-Thương binh và Xã hội (LĐ-TB&XH) đặt ra có cơ sở để hoàn thành.","category":"http://www.baomoi.com/Home/KinhTe.epi","content":"Theo ông Đào Công Hải, Phó cục trưởng Cục Quản lý lao động ngoài nước (Bộ LĐ-TB&XH): Năm 2013, mặc dù ngành xuất khẩu lao động gặp nhiều khó khăn, nhưng do nhu cầu cao từ các thị trường lao động truyền thống nên tổng số lao động xuất khẩu của nước ta vẫn đạt 88.000 người (vượt 3000 lao động so với chỉ tiêu). Bước sang năm 2014, mặc dù khó khăn chưa phải đã hết, song thị trường xuất khẩu lao động Việt Nam sẽ có nhiều thuận lợi hơn. Đó là, kinh tế khu vực Trung Đông đang có dấu hiệu phục hồi, mở ra hy vọng cho lao động ở các ngành nghề xây dựng và dịch vụ sang UAE, Ca-ta… Nếu mỗi quốc gia ở Trung Đông cần 100.000 lao động/năm, thì chúng ta cũng giải quyết được một số lượng lớn nhân công xây dựng trong nước đang dư thừa. \n Quang cảnh dây truyền mà những người lao động Việt Nam đang làm việc tại Nhật Bản. Còn với các quốc gia ở khu vực châu Phi và Trung Đông, Việt Nam sẽ ký kết thỏa thuận cấp Bộ trong một số lĩnh vực với Ăng-gô-la và A-rập Xê-út để tạo điều kiện phát triển việc làm an toàn cho lao động Việt Nam. Năm 2013, một loạt những quy định mới trong xuất khẩu lao động cũng đã được ban hành, theo đó quy định về xử phạt hành chính, mẫu hợp đồng lao động, mức ký quỹ… đều đã được quy định cụ thể. Hành lang pháp lý mới này sẽ là cơ sở nâng cao chất lượng xuất khẩu lao động trong năm 2014. \n Được biết, ngoài những thị trường trên, thời gian qua, hoạt động xuất khẩu lao động của nước ta tập trung khai thác những thị trường truyền thống. Theo Ban Quản lý lao động Việt Nam tại Đài Loan thì lao động đi làm việc ở Đài Loan trong năm 2014 sẽ thuận lợi hơn khi những chính sách mới của Việt Nam và Đài Loan đều tạo cơ hội thuận lợi cho việc tăng chất lượng, số lượng lao động sang Đài Loan làm việc. Mới đây, phía Đài Loan đã ban hành một số chính sách mới liên quan đến lao động nước ngoài, trong đó khuyến khích các doanh nghiệp Đài Loan tuyển dụng lao động nước ngoài và tạo điều kiện thuận lợi cho lao động nước ngoài tới làm việc ở Đài Loan. Về phía Việt Nam, để giảm áp lực về chi phí xuất khẩu lao động đi Đài Loan hiện còn cao, Bộ LĐ- TB&XH cũng tăng cường kiểm soát mức thu phí môi giới của các doanh nghiệp trong nước và giảm mức phí trần quy định từ 4.500USD năm 2013 xuống còn 4000USD vào năm 2014. \n Còn thị trường Hàn Quốc, gần đây cánh cửa vào thị trường này đã được mở lại tạo thêm cơ hội cho lao động Việt Nam. Cụ thể là, trong chuyến công tác tại Hàn Quốc vào cuối năm 2013, Bộ trưởng Bộ LĐ-TB&XH Phạm Thị Hải Chuyền đã ký Biên bản ghi nhớ (MOU) với Bộ Việc làm và Lao động Hàn Quốc về việc tiếp tục thực hiện Chương trình cử lao động sang Hàn Quốc làm việc (EPS) trong năm 2014. Theo Cục Quản lý lao động ngoài nước, đây là cơ hội để đưa khoảng 14.000 lao động sang Hàn Quốc trong năm 2014. Tuy nhiên, cũng cần phải lưu ý, bản ghi nhớ này chỉ có giá trị trong một năm và sau thời gian này, nếu số lao động là người Việt Nam bỏ trốn giảm, thì phía Hàn Quốc mới chính thức ký lại EPS với Việt Nam. \n Hoạt động xuất khẩu lao động của nước ta đã và đang gặp nhiều thuận lợi, nhưng vẫn còn không ít khó khăn cần phải giải quyết. Trong quá trình tổ chức các đoàn công tác và chỉ đạo các doanh nghiệp nghiên cứu khai thác các thị trường lao động có tiềm năng, ngành LĐ-TB&XH cần chỉ đạo họ khảo sát kỹ tình hình thực tế và kết nối với các cơ quan lao động tại các thị trường tiềm năng. Bên cạnh đó, cũng cần thắt chặt quản lý đào tạo, giáo dục định hướng và cải tiến đào tạo nghề, chuẩn hóa giáo trình đào tạo nghề cho người lao động… Còn phía người lao động, phải tuân thủ đúng pháp luật của nước sở tại, đừng vì lợi ích nhỏ của mình mà làm mất đi hình ảnh của người lao động Việt Nam trong con mắt bạn bè, quốc tế./ \n \u003Cb\u003EBài và ảnh: KHANH LÊ\u003C/b\u003E\n \n","crawl":1396951400128,"crawler":"news-1y-v1","htmlenc":"true","img_urls":[{"description":"Quang cảnh dây truyền mà những người lao động Việt Nam đang làm việc tại Nhật Bản.","url":"http://image.qdnd.vn//Upload/nguyenthao/2014/4/8/thao941401161931830.jpg"}],"isoLanguageCode":"vn","media":"news","pub":1396950240000,"region":"vn","source_url":"QĐND","tags":["xuất khẩu lao động","Đài Loan","Bộ Lao Động Thương Binh Xã Hội","Hàn Quốc","lao động nước ngoài","người lao động","biên bản ghi nhớ","EPS","làm việc","Trung Đông","Quân Đội Nhân Dân","Nhật Bản","Trung Quốc","Malaysia","Đông Âu"],"title":"Hoạt động xuất khẩu lao động trong năm 2014: Những tín hiệu tích cực","url":"http://www.baomoi.com/Hoat-dong-xuat-khau-lao-dong-trong-nam-2014-Nhung-tin-hieu-tich-cuc/47/13514473.epi","valid":"true"}
http://www.baomoi.com/Sap-khai-mac-hoi-cho-VIETNAM-EXPO-2014/45/13514455.epi	2014/04/08 05:03:20	2014/04/08 04:44:00	{"abstract":"Theo thông tin từ ban tổ chức, đến nay, đã có hơn 600 doanh nghiệp Việt Nam và quốc tế đăng ký tham gia Hội chợ với 750 gian hàng. Trong đó 320 doanh nghiệp Việt Nam và các doanh nghiệp nước ngoài tại Việt Nam tham gia trưng bày 382 gian hàng; 280 doanh nghiệp nước ngoài với 368 gian hàng.","category":"http://www.baomoi.com/Home/KinhTe.epi","content":"\n \nĐặc biệt, VIETNAM EXPO 2014 có sự tham gia của 23 quốc gia và vùng lãnh thổ: Ấn Độ, Cuba, Campuchia, Ba Lan, Bồ Đào Nha, CH Séc, Đài Loan, Indonesia, Hồng Kông, Hàn Quốc, Mỹ, Lào, Malaysia, Mông Cổ, Nepal, Nam Phi, Thụy Sỹ, Tây Ban Nha, Trung Quốc, Pakistan, Singapore, Ý và Việt Nam. \n \n VIETNAM EXPO hàng năm thu hút sự tham gia của nhiều doanh nghiệp trong và ngoài nước.\n \nGian hàng thông tin tư vấn xúc tiến xuất khẩu do Cục Xúc tiến thương mại (Bộ Công Thương) chủ trì nhằm cung cấp tại chỗ các thông tin về thị trường, sản phẩm và các đối tác liên quan đến hoạt động xuất khẩu của Việt Nam, đồng thời kết nối hoạt động giao thương giữa các doanh nghiệp Việt Nam và nước ngoài tại Hội chợ. \n \nKhu gian hàng Xúc tiến Đầu tư Công nghiệp “Invest in Vietnam” do Cục Xúc tiến thương mại tổ chức với thiết kế ấn tượng, dàn dựng công phu, sẽ trưng bày và giới thiệu các địa phương, khu công nghiệp (KCN Vĩnh Phúc, Hà Nam, KCN Phố Nối, KCN Phú Mỹ 3, KCN Quế Võ II), là điểm đến đầu tư đáng tin cậy trên bản đồ đầu tư cả nước. \n \nCác ngành hàng được trưng bày bao gồm: máy móc, thiết bị công nông nghiệp, xây dựng - vật liệu Xây dựng & trang trí nội ngoại thất, điện, điện tử & công nghệ thông tin, nguyên phụ liệu dệt may, da giày & máy dệt, thực phẩm, đồ uống & phụ gia thực phẩm, hàng gia dụng... \n \nLễ khai mạc hội chợ sẽ diễn ra vào lúc 9h00 ngày 16/4/2014 tại Trung tâm Hội chợ triển lãm Việt Nam (Giảng Võ, Hà Nội). \n \n Hoàng Dương \n","crawl":1396951400128,"crawler":"news-1y-v1","htmlenc":"true","img_urls":[{"description":"","url":"http://media.baotintuc.vn/2014/04/08/16/39/VIETNAM-EXPO-2013-00225.jpg"}],"isoLanguageCode":"vn","media":"news","pub":1396950240000,"region":"vn","source_url":"Báo Tin tức","tags":["gian hàng","hội chợ","khu công nghiệp","Cục Xúc tiến Thương mại","doanh nghiệp Việt Nam","trưng bày","công ty nước ngoài","Trung Tâm Hội Chợ Triển Lãm Việt Nam","hoàng dương","công nông nghiệp","hàng gia dụng","Ấn Độ","Cuba","Campuchia","Ba Lan"],"title":"Sắp khai mạc hội chợ VIETNAM EXPO 2014","url":"http://www.baomoi.com/Sap-khai-mac-hoi-cho-VIETNAM-EXPO-2014/45/13514455.epi","valid":"true"}
http://www.baomoi.com/Vang-bat-ngo-tang-thang-dung/126/13514465.epi	2014/04/08 05:03:20	2014/04/08 04:43:00	{"abstract":"TTO - 15g30 chiều nay giá vàng thế giới bất ngờ tăng 12,6 USD/ounce, lên hơn 1.310 USD/ounce. Quy đổi theo tỷ giá niêm yết tại các ngân hàng, giá vàng thế giới tương đương 33,4 triệu đồng/lượng.","category":"http://www.baomoi.com/Home/KinhTe.epi","content":"Giá vàng thế giới tăng khá bất ngờ do trước đó các phân tích đều theo hướng giá vàng còn tiếp tục giảm - Ảnh: TTO\n Giá vàng miếng SJC cũng tăng theo đà tăng của giá vàng thế giới nhưng tốc độ chậm hơn, lúc 15g30 giá vàng miếng SJC bán ra ở 35,7 triệu đồng/lượng, tăng 70.000 đồng/lượng so với cuối ngày hôm qua. \n Hiện giá vàng trong nước cao hơn giá vàng thế giới 2,3 triệu đồng/lượng. \n Các công ty vàng cho biết giao dịch trong những ngày gần đây rất trầm lắng do giá vàng chỉ biến động trong biên độ hẹp. Hơn nữa sau nhiều biện pháp giới hạn của cơ quan quản lý, lực lượng đầu cơ không còn nên giao dịch trên thị trường hầu hết là người có nhu cầu thật. \n Trong khi đó diễn biến giá vàng thế giới tăng khá bất ngờ do trước đó các phân tích đều theo hướng giá vàng còn tiếp tục giảm. Ngân hàng Morgan Stanley còn cho rằng vàng là hàng hóa ít được ưu tiên nhất trong số các kim loại.\n Hiện thông tin hỗ trợ giá vàng là tình hình căng thẳng ở Ukraine đang có chiều hướng gia tăng khi thành phố miền đông Donetsk tuyên bố sẽ tổ chức trưng cầu dân ý về gia nhập Nga vào ngày 11-5. \n A.H.\n\n","crawl":1396951400128,"crawler":"news-1y-v1","htmlenc":"true","img_urls":[{"description":"","url":"http://images.tuoitre.vn/tianyon/ImageView.aspx?ThumbnailID=699969"}],"isoLanguageCode":"vn","media":"news","pub":1396950180000,"region":"vn","source_url":"Tuổi Trẻ","tags":["giá vàng","SJC","vàng","giao dịch","Morgan Stanley","quy đổi","ngân hàng","trưng cầu dân ý","phân tích","biên độ","tỉ giá","Ukraina","Nga"],"title":"Vàng bất ngờ tăng thẳng đứng","url":"http://www.baomoi.com/Vang-bat-ngo-tang-thang-dung/126/13514465.epi","valid":"true"}
http://www.baomoi.com/Volvo-dat-muc-tieu-ban-1-trieu-xe-moi-nam/45/13514442.epi	2014/04/08 05:03:20	2014/04/08 04:43:00	{"abstract":"Tập đoàn Volvo đang đặt mục tiêu doanh số hàng năm trên 1 triệu xe trong chiến lược dài hạn khi chứng kiến sự tăng trưởng mạnh tại thị trường Trung Quốc.","category":"http://www.baomoi.com/Home/KinhTe.epi","content":"Chủ tịch Volvo Li Shufu cho biết hãng đạt mục tiêu doanh số 800.000 xe vào năm 2020, gần gấp đôi so với mức của năm ngoái, trong đó phần lớn nhờ vào tăng trưởng tại quốc gia đông dân nhất thế giới.\n \n “Mục tiêu dài hạn sau năm 2020 là trên 1 triệu xe”, ông Li Shufu trả lời tờ dailyDagens Industri của Thụy Điển. “Trung Quốc là một thị trường xe hơi tăng trưởng nhanh chóng, nơi người tiêu dùng ngày càng trưởng thành. Đó là lý do tại sao Volvo có mức tăng trưởng nhanh hơn các thương hiệu khác”, ông Shufu nói thêm.\n Thuộc sở hữu của tập đoàn Zhejiang Geely Holding Group (Trung Quốc), Volvo đã chứng kiến tháng thứ 9 tăng trưởng liên tiếp nhờ nhu cầu bùng nổ tại Trung Quốc và sự phục hồi ở Mỹ. Hãng xe Thụy Điển cho biết đã bán 47;850 xe trên toàn cầu trong tháng 3, tăng 17.9% so với cùng kỳ, còn doanh số quí I đạt 108.170 xe, tăng 9,5%.\n Trung Quốc là thị trường lớn nhất của Volvo với doanh số tăng hơn 25% trong 3 tháng đầu năm.\n \u003Cstrong\u003EPhúc Lân\u003C/strong\u003E (TTTĐ)\n \n","crawl":1396951400128,"crawler":"news-1y-v1","htmlenc":"true","img_urls":[{"description":"","url":"http://cdn3.autodaily.vn/2014/4/Volvo-V60.jpg"}],"isoLanguageCode":"vn","media":"news","pub":1396950180000,"region":"vn","source_url":"Autodaily","tags":["Volvo","tăng trưởng","doanh số","Trung Quốc","mục tiêu","Geely","Thụy Điển","chứng kiến","tập đoàn","thị trường ô tô","xe tăng","Mỹ"],"title":"Volvo đặt mục tiêu bán 1 triệu xe mỗi năm","url":"http://www.baomoi.com/Volvo-dat-muc-tieu-ban-1-trieu-xe-moi-nam/45/13514442.epi","valid":"true"}
http://www.baomoi.com/Nga-de-xuat-su-dung-dong-ruble-trong-giao-dich-quoc-te/45/13514448.epi	2014/04/08 05:03:20	2014/04/08 04:43:00	{"abstract":"Các nghị sỹ Duma Quốc gia (Hạ viện Nga) vừa đề nghị các công ty xuất khẩu Nga cân nhắc về khả năng chuyển đổi hình thức thanh toán từ đồng USD sang đồng ruble đối với các hợp đồng thương mại quốc tế.","category":"http://www.baomoi.com/Home/KinhTe.epi","content":"Đồng ruble Nga. (Nguồn: forexmagnates.com) \n \n Ông Andrei Kostin, người đứng đầu VTB - ngân hàng lớn thứ hai ở Nga, đã bày tỏ sự ủng hộ \"ý tưởng\" trên vì cho rằng nó sẽ giúp nền kinh tế Nga giảm bớt những ảnh hưởng từ các tác động bên ngoài. \n \n Theo ông, Nga có thể giảm sự phụ thuộc vào những thay đổi thất thường của Mỹ và Liên minh châu Âu (EU) nếu các đối tác thương mại nước ngoài dùng tiền ruble để thanh toán những lô hàng xuất khẩu. \n \n Trước đây, ý tưởng chuyển đổi này cũng từng được đưa ra bàn thảo. Tuy nhiên, trong bối cảnh phương Tây áp dụng các biện pháp trừng phạt Moskva sau sự kiện Liên bang Nga sáp nhập bán đảo Crimea vào lãnh thổ của mình, ý tưởng này lại càng được quan tâm hơn bao giờ hết. \n \n Nga có thể bắt đầu áp dụng thay đổi hình thức thanh toán trong các giao dịch quốc tế đối với hai mặt hàng dầu mỏ và khí đốt. Tuy vậy, việc biến ý tưởng này thành hiện thực không phải là điều đơn giản do chu trình chuyển đổi có thể rất tốn kém, phức tạp, cũng như do đồng USD vốn là ngoại tệ quen thuộc, thuận tiện với các nhà xuất khẩu và được toàn thế giới công nhận. \n \n Bình luận về khả năng chuyển đổi hình thức thanh toán này, một số chuyên gia bày tỏ lo ngại về việc các nhà xuất khẩu của Nga có thể bị thiệt hại do lạm phát, khi đồng ruble bị tổn thương. \n \n Tuy nhiên, chuyên gia kinh tế Mikhail Khazin cho rằng nếu có sự chuẩn bị tốt các hợp đồng thương mại, điều đó sẽ không ảnh hưởng đến doanh thu của các hãng. \n \n Về phần mình, ông Mikhail Krylov, giám đốc bộ phận phân tích của hãng UnitedTraders nhận định, điều cần lo lắng là khả năng tăng giá quá mức của đồng Ruble, chắc chắn sẽ xảy ra trong trường hợp các khách hàng quốc tế có nhu cầu sử dụng lớn đồng tiền quốc gia này, dù chỉ là với các hợp đồng mua bán khí đốt của Nga. \n \n Nhiều chuyên gia kinh tế của Nga cho rằng quá trình chuyển đổi hình thức thanh toán quốc tế bằng đồng ruble có thể là triển vọng dài hạn đối với Nga, song cũng cần lập kế hoạch cụ thể ngay từ bây giờ bên cạnh việc học tập kinh nghiệm của Trung Quốc. \n \n Từ lâu, Bắc Kinh đã thực hiện những bước đi trong lĩnh vực tiền tệ để giảm bớt sự phụ thuộc vào đồng USD, chuyển một phần sang thanh toán với các đối tác bằng đồng Nhân dân tệ./. \n Xem thêm : Căng thẳng ở Ukraine \n","crawl":1396951400128,"crawler":"news-1y-v1","htmlenc":"true","img_urls":[{"description":"","url":"http://img1.vietnamplus.vn/t300/Uploaded/mzdic/2014_04_08/Rubles20140804.jpg"}],"isoLanguageCode":"vn","media":"news","pub":1396950180000,"region":"vn","source_url":"Vietnam Plus","tags":["Ruble","Nga","thanh toán","khả năng chuyển đổi","Duma Quốc gia Nga","xuất khẩu","ý tưởng","khí đốt","chuyển đổi","hình thức","chuyên gia kinh tế","thương mại quốc tế","VTB","Mỹ","Liên minh châu Âu"],"title":"Nga đề xuất sử dụng đồng ruble trong giao dịch quốc tế","url":"http://www.baomoi.com/Nga-de-xuat-su-dung-dong-ruble-trong-giao-dich-quoc-te/45/13514448.epi","valid":"true"}
http://www.baomoi.com/Thi-truong-ban-le-quy-I-cung-tang-gia-thue-tiep-tuc-giam/50/13514472.epi	2014/04/08 05:03:20	2014/04/08 04:42:00	{"abstract":"Quý I/2014 nguồn cung gia nhập thị trường tại 2 thành phố Hà Nội và TP Hồ Chí Minh tăng. Sức cầu yếu, chứng tỏ khả năng hấp thụ của thị trường bán lẻ yếu. Khi cung tăng nhưng cầu yếu thì công suất thuê tại 2 thành phố giảm là tất yếu, theo ghi nhận của Savills Việt Nam.","category":"http://www.baomoi.com/Home/KinhTe.epi","content":"Theo đó, trong quý I/2014, thị trường bán lẻ Hà Nội có thêm hai dự án khối đế bán lẻ mới. Tổng cung toàn thị trường đạt khoảng 1 triệu m², tăng 1% theo quý và 36% theo năm. Trung tâm mua sắm là loại hình bán lẻ chiếm ưu thế với 570.000 m², chiếm 55% thị phần; trong khi trung tâm bách hóa chiếm thị phần ít nhất với 4%.\n \nRobins, thương hiệu trung tâm thương mại hàng đầu của Thái Lan đã có mặt tại Hà Nội\n Hoạt động của thị trường bán lẻ Hà Nội vẫn trong xu hướng giảm, xét trên cả công suất và giá thuê. Giá thuê của toàn thị trường giảm -4% theo quý và -6% theo năm, đạt mức 1,1 triệu VND/ m²/ tháng. Công suất toàn thị trường đạt 82%, giảm -1 điểm % theo quý và -7 điểm % theo năm. Khu vực quận trung tâm (CBD) có giá thuê cao nhất, đạt 2,1 triệu VND/ m²/ tháng, cao hơn rất nhiều so với các khu vực quận ngoại thành (650.000 VND/ m²/ tháng) và các quận nội thành (860.000 VND/ m²/ tháng). Công suất của các trung tâm mua sắm, trung tâm bách hóa và đại siêu thị ở Hà Nội khá ổn định từ quý I/2013.\n Chỉ số giá tiêu dùng của Hà Nội quý I/2014 ở mức thấp. Cụ thể, chỉ số giá theo tháng là 0,7% trong tháng 1, 0,49% trong tháng 2 và -0,15% trong tháng 3. Chỉ số giá tiêu dùng thấp thể hiện sức cầu yếu, làm giảm hiệu quả hoạt động kinh doanh của thị trường bán lẻ Hà Nội. Diện tích cho thuê thêm của toàn thị trường quý này ở mức âm.\n Savills ghi nhận không khí mua sắm trầm lắng và lượng người đến các trung tâm mua sắm lớn ở Hà Nội khá ít, do đó hoạt động kinh doanh của các khách thuê cũng không khả quan. Khả năng chi trả tiền thuê mặt bằng của khách thuê trong dài hạn vẫn còn là một dấu hỏi.\n Chưa kể, Hà Nội dự kiến có thêm 100 dự án bán lẻ, cung cấp khoảng 1,8 triệu m² từ quý II/2014 trở đi. Trong đó, 800.000 m² sàn bán lẻ, tương đương với 77% nguồn cung hiện tại, sẽ tham gia thị trường từ nay tới cuối năm 2015. Dự kiến cạnh tranh sẽ tăng mạnh và thị trường bán lẻ sẽ chịu áp lực ngày càng lớn.\n Trong khi đó, tổng nguồn cung bán lẻ toàn thị trường TP. Hồ Chí Minh vào khoảng 850.000 m 2 , tăng mạnh 8% so với quý trước và 7% so với cùng kỳ năm trước do sự gia nhập của 1 trung tâm mua sắm, 1 trung tâm bách hóa và 1 siêu thị.\n \nNguồn cung bán lẻ TP. Hồ Chí Minh quý I/2014\n Khu vực ngoại thành chiếm thị phần bán lẻ lớn nhất với 43% tổng nguồn cung, tiếp đến là khu vực nội thành (36%) và khu vực trung tâm (21%).\n Tình hình hoạt động của thị trường bán lẻ khả quan hơn trong quý này với công suất cho thuê tăng trưởng tốt, khoảng 4% so với quý trước. Giá thuê trung bình giảm nhẹ khoảng -1% so với quý trước.\n Công suất thuê trung bình của trung tâm bách hóa tăng 6% so với quý trước trong khi công suất thuê của trung tâm mua sắm tăng 3% so với quý trước; nguyên nhân chính là do tình hình hoạt động tốt của các dự án mới. \n Doanh thu bán lẻ của TP. Hồ Chí Minh trong quý I/ 2014 ước đạt 152.000 tỷ đồng. Loại trừ yếu tố lạm phát, doanh thu bán lẻ tăng khoảng 7,2% so với cùng kỳ năm trước, tương đương với năm 2013.\n Lãnh đạo của Savills cho rằng, mức tăng không đổi của doanh thu bán lẻ chỉ ra rằng sức mua không cải thiện. Phân khúc bán lẻ trung cấp có thể sẽ hoạt động tốt hơn phân khúc cao cấp trong các quý tiếp theo. Nhu cầu về mặt bằng bán lẻ đối với các loại hình đồ ăn và thức uống, siêu thị và một số sản phẩm và dịch vụ thiết yếu có thể vẫn ở mức cao.\n Từ quý II/ 2014 trở đi, khoảng 1,3 triệu m 2 diện tích bán lẻ mới sẽ gia nhập thị trường. Tuy nhiên, khoảng 70% số dự án này chưa có thời gian hoàn thành dự kiến cụ thể. Quận 1, 2 và 7 chiếm diện tích bán lẻ tương lai lớn nhất trong tất cả các quận, khoảng 63% tổng nguồn cung tương lai.\n \u003Cstrong\u003E T.Hà\u003C/strong\u003E\n\n","crawl":1396951400128,"crawler":"news-1y-v1","htmlenc":"true","img_urls":[{"description":"","url":"http://thoibaonganhang.vn/upload/news/hantt/2014/04/5343c19dd4cef_medium.jpg"},{"description":"","url":"http://thoibaonganhang.vn/upload/news/hantt/2014/04/5343c244c9ddb_medium.JPG"}],"isoLanguageCode":"vn","media":"news","pub":1396950120000,"region":"vn","source_url":"Thời báo Ngân hàng","tags":["bán lẻ","quý I","nguồn cung","bách hóa","công suất","mua sắm","Savills","VNĐ","thị trường","Hà Nội","chỉ số giá tiêu dùng","TP HCM","trung tâm thương mại","Thái Lan","lạm phát"],"title":"Thị trường bán lẻ quý I, cung tăng, giá thuê tiếp tục giảm","url":"http://www.baomoi.com/Thi-truong-ban-le-quy-I-cung-tang-gia-thue-tiep-tuc-giam/50/13514472.epi","valid":"true"}
