http://www.baomoi.com/Techcombank-2014-Muc-tieu-loi-nhuan-truoc-thue-1181-ty-dong/126/13513074.epi	2014/04/08 05:03:20	2014/04/08 02:31:00	{"abstract":"BizLIVE - Tỷ lệ nợ xấu của Techcombank dự kiến giảm xuống 3%, so với mức 3,65% vào cuối năm 2013.","category":"http://www.baomoi.com/Home/KinhTe.epi","content":"Ảnh minh họa.\n Ngân hàng TMCP Kỹ thương Việt Nam (Techcombank - TCB) vừa công bố tài liệu Đại hội cổ đông thường niên tổ chức vào 19/4 tới.\n Theo đó, trong năm 2014, ngân hàng trình cổ đông thông qua kế hoạch tăng tổng tài sản tăng 8% lên 170.956 tỷ đồng, huy động vốn tăng 16% lên 142.683 tỷ, dư nợ tín dụng tăng 13% lên 106.833 tỷ đồng. \n Tỷ lệ nợ xấu dự kiến giảm xuống 3%, so với mức 3,65% vào cuối năm 2013.\n Lợi nhuận trước thuế 2014 dự kiến 1.181 tỷ đồng, tốc độ tăng 35% so với năm 2013.\n \u003Cstrong\u003ETính đến cuối 2013\u003C/strong\u003E, vốn điều lệ của Techcombank là 8.787 tỷ đồng, tăng thêm 30 tỷ đồng so với cuối năm 2012. Tổng tài sản ngân hàng đạt 158.896 tỷ đồng, giảm 11,7% so với năm 2012 và đạt 93% kế hoạch. \n Lợi nhuận trước thuế cả năm của toàn ngân hàng đạt 878 tỷ đồng, giảm 13,8% so với năm 2012 và đạt 81,3% kế hoạch.\n \n Về các hoạt động công ty con, Công ty Quản lý tài sản Techcombank – TechcomAMC đạt lợi nhuận trước thuế hơn 10 tỷ đồng, Chứng khoán Kỹ thương – TCS đạt 132 tỷ đồng, Công ty Quản lý quỹ Techcombank – TCC đạt 7,6 tỷ đồng.\n \n Tổng huy động toàn ngân hàng đạt 119.978 tỷ đồng, tăng 7,6% so với 2012 và đạt 107% kế hoạch.\n \n Tổng dư nợ khách hàng tính đến cuối năm 2013 là 70.274 tỷ đồng, tăng 2,9% so với 2012 và đạt 101,2% kế hoạch.\n Tỷ lệ an toàn vốn tối thiểu tới cuối năm 2013 đạt 14,03% cao hơn mức 9% theo yêu cầu của Ngân hàng Nhà nước.\n \n","crawl":1396951400128,"crawler":"news-1y-v1","htmlenc":"true","img_urls":[{"description":"","url":"http://bizlive.vn/Uploaded/hanhpham/2014_04_08/tach_PYDZ.jpg?width=670&height=350&crop=auto"}],"isoLanguageCode":"vn","media":"news","pub":1396942260000,"region":"vn","source_url":"BizLive","tags":["Techcombank","lợi nhuận trước thuế","nợ xấu","dư nợ","ngân hàng","kế hoạch","tổng tài sản","giảm xuống","tỉ lệ","công ty quản lý quỹ","đại hội cổ đông","Ngân hàng Nhà nước Việt Nam"],"title":"Techcombank 2014: Mục tiêu lợi nhuận trước thuế 1.181 tỷ đồng","url":"http://www.baomoi.com/Techcombank-2014-Muc-tieu-loi-nhuan-truoc-thue-1181-ty-dong/126/13513074.epi","valid":"true"}
http://www.baomoi.com/VNM-Quy-lon-cua-Dragon-Capital-dang-ky-ban-34-trieu-co-phieu/127/13513000.epi	2014/04/08 05:03:20	2014/04/08 02:30:00	{"abstract":"Thời gian dự kiến thực hiện giao dịch là từ 11/4 tới 10/5, theo phương thức thỏa thuận.","category":"http://www.baomoi.com/Home/KinhTe.epi","content":"Công ty CP Sữa Việt Nam (Vinamilk - mã VNM ) thông báo giao dịch của tổ chức có liên quan Vietnam Enterprise Investment Limited (VEIL). \n \nTheo đó, quỹ VEIL của Dragon Capital đăng ký bán 3, 4 triệu cổ phiếu VNM để cơ cấu lại danh mục đầu tư. Tỷ lệ sở hữu của quỹ VEIL sau giao dịch giảm từ 1,69% xuống còn 1,29% tổng lượng cổ phiếu VNM đang lưu hành, tương đương giảm số cổ phiếu nắm giữ xuống 10,7 triệu cổ phiếu. \n \n \n","crawl":1396951400128,"crawler":"news-1y-v1","htmlenc":"true","img_urls":[],"isoLanguageCode":"vn","media":"news","pub":1396942200000,"region":"vn","source_url":"Gafin.vn","tags":["VNM","VEIL","cổ phiếu","Dragon Capital","giao dịch","danh mục đầu tư","Vinamilk","đăng ký","lưu hành","sữa","nắm giữ"],"title":"VNM: Quỹ lớn của Dragon Capital đăng ký bán 3,4 triệu cổ phiếu","url":"http://www.baomoi.com/VNM-Quy-lon-cua-Dragon-Capital-dang-ky-ban-34-trieu-co-phieu/127/13513000.epi","valid":"true"}
http://www.baomoi.com/Ngan-hang-giam-tiep-lai-suat-tiet-kiem-VND/126/13513599.epi	2014/04/08 05:03:20	2014/04/08 02:27:00	{"abstract":"(HNMO) - Tiếp đợt giảm trước và sau khi Ngân hàng Nhà nước quyết định hạ lãi suất điều hành, những ngày qua, một số ngân hàng thương mại điều chỉnh giảm thêm lãi suất huy động VND.","category":"http://www.baomoi.com/Home/KinhTe.epi","content":"\u003Cstrong\u003E\n \u003C/strong\u003E Ảnh minh họa \n Chẳng hạn, theo biểu lãi suất mới tại Eximbank, thay vì mức 6%/năm như trước, lãi suất tiền gửi kỳ hạn 1-3 tháng tại ngân hàng này còn 5,7%/năm; lãi suất cho kỳ hạn 4-5 tháng là 5,98%, thấp hơn trước 0,02%/năm. Tuy nhiên, với kỳ hạn dài, Eximbank vẫn giữ nguyên. Theo đó, kỳ hạn 24-60 tháng vẫn được hưởng lãi suất 7,8%/năm. \n \n Từ ngày 1/4, Maritimebank đã điều chỉnh giảm lãi suất tiết kiệm kỳ hạn ngắn 1-3 tháng xuống 5,7%/năm, giảm 0,3% so với trước. Lãi suất cho các kỳ hạn 4-5 tháng hạ 0,2%, còn 5,8%/năm. Ngân hàng này niêm yết lãi suất cao nhất là 8%/năm cho kỳ hạn 24 tháng và 36 tháng. \n \n Việc giảm trên đã đưa lãi suất kỳ hạn ngắn tại một số ngân hàng thương mại cổ phần về sát với lãi suất của ngân hàng thương mại Nhà nước. Chẳng hạn, tại Agribank và Vietcombank, và lãi suất huy động VND đối với kỳ hạn 1 tháng và 2 tháng đang là 5,5%/năm và 5,8%/năm. Thậm chí, lãi suất ở kỳ hạn 4-5 tháng còn thấp hơn cả ngân hàng thương mại Nhà nước bởi tại VCB và Agribank kỳ hạn 3 tháng cùng có lãi suất là 6%/năm... \n \n Theo Ngân hàng Nhà nước, sau khi cơ quan quản lý này điều chỉnh giảm các lãi suất điều hành kể từ ngày 18/3 vừa qua, các tổ chức tín dụng đã nghiêm túc chấp hành quy định của NHNN, lãi suất huy động kỳ hạn từ 1 tháng đến dưới 6 tháng của các ngân hàng thương mại Nhà nước và một số ngân hàng thương mại cổ phần lớn thấp hơn mức lãi suất tối đa đối với tiền gửi bằng VND. Hiện nay, lãi suất huy động bằng VND phổ biến ở mức 0,8-1%/năm đối với tiền gửi không kỳ hạn và có kỳ hạn dưới 1 tháng; 5-6%/năm đối với tiền gửi có kỳ hạn 1 tháng và dưới 6 tháng; 6-7,5%/năm đối với tiền gửi có kỳ hạn từ 6 tháng đến dưới 12 tháng, kỳ hạn trên 12 tháng 7,5-8,3%/năm. \n \n Song song với giảm lãi suất huy động, các tổ chức tín dụng cũng nghiêm túc thực hiện quy định lãi suất cho vay ngắn hạn tối đa bằng VND đối với các lĩnh vực ưu tiên theo quy định của NHNN. Lãi suất cho vay phổ biến đối với các lĩnh vực ưu tiên ở mức 8%/năm theo quy định của Ngân hàng Nhà nước, lãi suất cho vay các lĩnh vực sản xuất kinh doanh thông thường ở mức khoảng 9-10,5%/năm đối với ngắn hạn; 11-12,5%/năm đối với trung và dài hạn. Một số ngân hàng thương mại tiếp tục áp dụng lãi suất cho vay đối với một số doanh nghiệp có tình hình tài chính lành mạnh, minh bạch, phương án, dự án sản xuất kinh doanh hiệu quả chỉ ở mức 6-7%/năm. \n \n Việc một số ngân hàng thương mại giảm thêm lãi suất tiết kiệm cho thấy các nhà băng đang dư tiền dù rằng đã giảm lãi suất cho vay. Chính vì thế họ phải cắt giảm chi phí đầu vào. \n \n Liên quan đến lãi suất, tại buổi làm việc với tỉnh An Giang vừa qua, Thống đốc Ngân hàng Nhà nước Nguyễn Văn Bình nhận định, lạm phát năm 2014 sẽ vào khoảng 6%; mặt bằng lãi suất có nhiều khả năng sẽ ở mức như hiện nay, nếu có điều kiện thì các tổ chức tín dụng sẽ giảm tiếp, nhưng có lẽ chỉ giảm thêm 1-2%. \n","crawl":1396951400128,"crawler":"news-1y-v1","htmlenc":"true","img_urls":[{"description":"Ảnh minh họa","url":"http://hanoimoi.com.vn/Uploads/image/Ngo%20Huong/NH/VND%2022-9.jpg"}],"isoLanguageCode":"vn","media":"news","pub":1396942020000,"region":"vn","source_url":"Hà Nội Mới","tags":["kỳ hạn","lãi suất","lãi suất huy động","ngân hàng thương mại","VNĐ","Ngân hàng Nhà nước Việt Nam","cho vay","lãi suất tiết kiệm","tổ chức tín dụng","ngân hàng","Ngân hàng Nông nghiệp Và Phát triển Nông thôn Việt Nam","Eximbank","lãi suất tiền gửi","MaritimeBank","Vietcombank"],"title":"Ngân hàng giảm tiếp lãi suất tiết kiệm VND","url":"http://www.baomoi.com/Ngan-hang-giam-tiep-lai-suat-tiet-kiem-VND/126/13513599.epi","valid":"true"}
http://www.baomoi.com/CPI-quy-I-tang-thap-tin-hieu-khoi-sac-cua-nen-kinh-te-Viet-Nam/50/13513097.epi	2014/04/08 05:03:20	2014/04/08 02:27:00	{"abstract":"CPI trong 3 tháng đầu năm tăng thấp là tín hiệu khả quan để năm 2014 sẽ vượt mục tiêu.","category":"http://www.baomoi.com/Home/KinhTe.epi","content":"Tổng cục Thống kê vừa chính thức công bố chỉ số giá tiêu dùng (CPI ) tháng 3/2014 củacả nước giảm 0,44% so với tháng trước, tăng 4,12% so với cùng kỳ năm trước.Tính trung bình, CPI 3 tháng đầu năm 2014 đã tăng 4,83% so với 3 tháng đầu năm ngoái (2013). CPItháng 1 tăng 0,69%, tháng 2 tăng 0,55%, 2 tháng tăng 1,24%, là mức tăng thấp nhất trong 10 năm qua.\n Tính chung, tốc độ tăng giá tiêu dùng của 3 tháng đầu năm tăng thấp nhất trong 13 năm qua và thấp xa so với CPI bình quân cùng kỳ trong 12 năm trước.\n Các chuyên gia kinh tế cho rằng, CPI trong 3 tháng đầu năm tăng thấp là tín hiệu khả quan để năm 2014 sẽ vượt (thấp hơn) mục tiêu theo Nghị quyết của Quốc hội đề ra (khoảng 7%) và là năm thứ ba liên tục tăng thấp, thậm chí còn kỳ vọng sẽ là năm thứ ba liên tục tăng thấp xuống (năm 2012 tăng 6,81%, năm 2013 tăng 6,04%, năm 2014 theo quyết tâm của Chính phủ sẽ thấp hơn 6%.\n Theo đánh giá, CPI tháng 3/2014 giảm là phù hợp với quy luật, chỉ giảm hoặc tăng nhẹ, bởi thông thường, sau kỳ nghỉ Tết, giá cả các nhóm hàng đều có xu hướng giảm.\n Liên quan đến việc CPI 3 quý I/2014 tăng thấp, có ý kiến cho rằng, CPI tăng thấp có thể là do cầu yếu, nhưng các thành viên Chính phủ thảo luận và cho rằng, lạm phát thấp là do đợt Tết vừa qua, nguồn cung hàng hóa dồi dào, phong phú, hàng Việt Nam chất lượng cao ngày càng chiếm lĩnh thị trường\", Bộ trưởng Nguyễn Văn Nên nói và cho biết, dịp Tết, sức mua được cải thiện, nhưng vẫn bảo đảm ổn định giá cả, thị trường trong và sau Tết không xảy ra sốt giá.\n \"CPI 3 tháng đầu năm có tốc độ tăng tương đối thấp trong 10 năm gần đây, bình quân mỗi tháng tăng 0,27%. Đây là một tín hiệu lạc quan CPI sẽ giữ được mức ổn định trong năm nay\", bà Đỗ Thị Ngọc,Phó Vụ trưởng Vụ Thống kê giá (Tổng cục Thống kê)nhận định.\n Dự báo ra sao về chỉ số CPI tháng 4, bà Ngọc cho rằng, theo quy luật tiêu dùng của nhiều năm, tốc độ tăng CPI trong tháng 4 thường có xu hướng tăng nhẹ hoặc ổn định (trừ những năm 2008, 2011) quy luật tiêu dùng bị phá vỡ do chịu ảnh hưởng các đợt lạm phát hai con số, nguyên nhân từ sự tăng mức lương tối thiểu, tăng giá hàng hóa quốc tế, chính sách kích cầu, chính sách quản lý tỷ giá, độ mở của nền kinh tế nước ta, đặc biệt từ khi Việt Nam gia nhập WTO vào cuối năm 2006.\n Với giá cả các mặt hàng chiến lược như: xăng, dầu, điện… vẫn giữ được ổn định như hiện nay có thể dự báo CPI tháng 4 tới không diễn biến bất thường.\n Trước đó, phát biểu trong cuộc họp báo Chính phủ, Bộ trưởng, Chủ nhiệm Văn phòng Chính phủ Nguyên Văn Nên cho biết, mặc dù còn nhiều khó khăn, nhưng có nhiều tín hiệu vui, khởi sắc của nền kinh tế.\n Theo Đông Nam Á \n\n","crawl":1396951400128,"crawler":"news-1y-v1","htmlenc":"true","img_urls":[],"isoLanguageCode":"vn","media":"news","pub":1396942020000,"region":"vn","source_url":"NDH.vn","tags":["chỉ số giá tiêu dùng","tín hiệu","Tết","quy luật","Tổng Cục Thống Kê","tiêu dùng","giá cả","nền kinh tế","lạm phát","Nguyễn Văn Nên","quý I","chuyên gia kinh tế","Hàng Việt Nam chất lượng cao","kích cầu","Tổ chức Thương mại Thế giới"],"title":"CPI quý I tăng thấp, tín hiệu khởi sắc của nền kinh tế Việt Nam?","url":"http://www.baomoi.com/CPI-quy-I-tang-thap-tin-hieu-khoi-sac-cua-nen-kinh-te-Viet-Nam/50/13513097.epi","valid":"true"}
http://www.baomoi.com/Cong-ty-Truyen-Thong-Phan-Quang-can-tuyen-dung-nhan-vien-kinh-doanh/146/13512911.epi	2014/04/08 05:03:20	2014/04/08 02:26:00	{"abstract":"Tin dịch vụ - Sau 9 năm hoạt động, Phan Quang Communication tự hào trở thành đối tác với các khách hàng lớn như điện máy Thiên Hòa, điện máy Nguyễn Kim, Thế giới Di Động … Để thực hiện chiến lược phát triển kinh doanh trong tương lai, Phan Quang Communication cần tuyển một số vị trí sau:","category":"http://www.baomoi.com/Home/KinhTe.epi","content":"\u003Cstrong\u003E1.Nhân viên kinh doanh quảng cáo báo giấy\u003C/strong\u003E: 5 nam/nữ\nYêu cầu:\n-Tốt nghiệp THPT trở lên.\n-Nhanh nhẹn, giao tiếp tốt.\n-Biết sử dụng vi tính văn phòng.\n-Tuổi từ 18 đến 25\n \u003Cstrong\u003E2.Nhân viên PR báo giấy và báo online\u003C/strong\u003E: 5 nam/nữ\nYêu cầu:\n-Tốt nghiệp đại học ưu tiên các ngành kinh tế - XHNV\n-Nhanh nhẹn, giao tiếp tốt\n-Sử dụng thành thạo vi tính văn phòng\n-Có khả năng thuyết phục khách hàng\n-Tuổi từ 22 đến 25\n \u003Cstrong\u003E3.Nhân viên kinh doanh quảng cáo Online\u003C/strong\u003E: 5 nam /nữ\nYêu cầu:\n-Tốt nghiệp cao đẳng/đại học các khối marketing, quản trị kinh doanh, công nghệ thông tin và các ngành có liên quan\n-Nhanh nhẹn, giao tiếp tốt \n-Sử dụng thành thạo vi tính văn phòng \n-Có khả năng thuyết phục khách hàng\n-Tuổi từ 22 đến 25\n \n \u003Cstrong\u003E4.Điều kiện làm việc & chế độ đãi ngộ\n\u003C/strong\u003E- Chế độ đãi ngộ và mức lương cạnh tranh. \n- Thời gian làm việc theo giờ hành chính. \n- Làm việc tại thành phố Hồ Chí Minh.\n Chi tiết công việc sẽ trao đổi tại buổi phỏng vấn. \nƯu tiên ứng viên có kinh nghiệm bán hàng qua điện thoại, hiểu biết về marketing, truyền thông trực tuyến.\n\u003Cstrong\u003EYêu cầu chung\u003C/strong\u003E: Trong đơn xin việc vui lòng mô tả về bản thân, kinh nghiệm làm việc, sở trường, nguyện vọng, mục tiêu trong công việc…\n \n \n \u003Cstrong\u003ENộp hồ sơ trực tiếp tại :\n\u003C/strong\u003EĐịa chỉ: 355/4D sư vạn hạnh (nối dài), P.12, Q.10, TPHCM.\nThời gian: \n - Sáng 8h30 đến 11h00\n - Chiều: 14h00 đến 16h30\nHạn chót nhận hồ sơ: 25-04-2014 \n \n Tin dịch vụ\n\n","crawl":1396951400128,"crawler":"news-1y-v1","htmlenc":"true","img_urls":[{"description":"","url":"http://images.tuoitre.vn/tianyon/ImageView.aspx?ThumbnailID=698652"}],"isoLanguageCode":"vn","media":"news","pub":1396941960000,"region":"vn","source_url":"Tuổi Trẻ","tags":["vi tính","điện máy","chế độ đãi ngộ","giao tiếp","báo in","cần tuyển","nhân viên","văn phòng","kinh doanh","Thế Giới Di Động","giờ hành chính","Nguyễn Kim","PR","online","quảng cáo trực tuyến"],"title":"Công ty Truyền Thông Phan Quang cần tuyển dụng nhân viên kinh doanh","url":"http://www.baomoi.com/Cong-ty-Truyen-Thong-Phan-Quang-can-tuyen-dung-nhan-vien-kinh-doanh/146/13512911.epi","valid":"true"}
http://www.baomoi.com/Bo-Cong-thuong-trien-khai-thuc-hien-lo-trinh-phoi-tron-va-su-dung-xang-sinh-hoc/50/13513511.epi	2014/04/08 05:03:20	2014/04/08 02:26:00	{"abstract":"NDĐT- Sáng 8-4, tại Quảng Ngãi, Bộ Công thương phối hợp với Tập đoàn dầu khí Việt Nam (PVN) và UBND tỉnh Quảng Ngãi tổ chức Hội nghị triển khai thực hiện phối trộn nhiên liệu sinh học và nhiên liệu truyền thống, nhằm sớm đưa vào sử dụng nhiên liệu sinh học (xăng E5) theo lộ trình của Chính phủ.","category":"http://www.baomoi.com/Home/KinhTe.epi","content":"Nhiều cây xăng ở Quảng Ngãi hiện nay bán xăng E5. \u003Cb\u003E \n \u003C/b\u003E Theo Bộ Công thương, hiện cả nước có sáu nhà máy sản xuất ethanol sinh học từ nguyên liệu sắn lát trên cả nước. Trong đó, PVN có hai nhà máy tại Bình Sơn (Quảng Ngãi) và Bù Đăng (Bình Phước) với tổng công suất 200 triệu lít/năm. Bên cạnh đó, hiện có bốn nhà máy khác ngoài PVN sản xuất ethanol nhiên liệu đi vào hoạt động, công suất khoảng 335 triệu lít/năm. Như vậy, hiện cả nước có 535 triệu lít ethanol để pha chế xăng sinh học E5, đủ khả năng cung cấp pha chế xăng E5 và E10 năm 2014 và các năm tiếp theo là hoàn toàn khả thi.\n PV Oil (PVN) là đơn vị được giao chịu trách nhiệm làm đầu mối sản xuất và phát triển mạng lưới phân phối nhiên liệu sinh học. Hiện có năm trạm chế biến (theo mẻ) tại Hải Phòng, TPHCM, Đà Nẵng, Vũng Tàu và Cần Thơ với công suất pha chế 72.000 m³ xăng E5/năm, đang xây dựng kế hoạch đầu tư thêm hai trạm tại Hà Tĩnh và Cần Thơ. Đồng thời thí điểm toàn xăng E5 tại chín cửa hàng xăng dầu ở ba tỉnh Quảng Nam, Quảng Ngãi và Bà Rịa - Vũng Tàu thay cho xăng 92.\n Theo Quyết định số 53/2012/QĐ-TTg của Thủ tướng Chính phủ, từ tháng 12/2014 có bảy tỉnh, thành phố: Hà Nội, TP Hồ Chí Minh, Hải Phòng, Đà Nẵng, Cần Thơ, Quảng Ngãi, Bà Rịa - Vũng Tàu đã được lựa chọn để sử dụng xăng E5 cho phương tiện cơ giới đường bộ. Từ khi lộ trình áp dụng tỷ lệ phối trộn nguyên liệu sinh học (NLSH) với nhiên liệu truyền thống chính thức được Thủ tướng Chính phủ phê duyệt đã tạo sự chuyển biến lớn đối với tỉnh Quảng Ngãi - một trong những địa phương chọn thí điểm triển khai trước.\n Sở Công thương Quảng Ngãi cho biết, hiện nay toàn tỉnh đã triển khai vận động 29 trong tổng số 168 cửa hàng xăng dầu tham gia phân phối xăng sinh học E5, đạt tỷ lệ 17%, cao nhất cả nước. PVN đang chỉ đạo xây dựng phương án, kế hoạch phối trộn ethanol với toàn bộ xăng M 92 tại Nhà máy lọc dầu Dung Quất theo các tỷ lệ 3% ethanol (E3) và 5% ethanol (E5) để thúc đẩy phát triển thị trường xăng sinh học tại Việt Nam; đồng thời chỉ đạo việc đầu tư, phát triển hệ thống phân phối xăng E5 tại đây để đảm bảo cung ứng đủ E5 cho tỉnh Quảng Ngãi và các tỉnh lân cận.\n \n Cán bộ kỹ thuật của Nhà máy Bio - Ethanol Dung Quất kiểm tra chất lượng sản phẩm. \n Tuy nhiên, thực tế hiện nay nhận thức và sự ủng hộ của người dân về lợi ích cũng như việc dùng xăng pha 5% Ethanol chưa cao, trong khi xăng sinh học E5, E10 đã có đầy đủ cơ sở khoa học cũng như pháp lý đảm bảo cho việc sử dụng tại Việt Nam.\n Nhiều đại biểu dự hội nghị đã tham gia thảo luận và kiến nghị với các Bộ, ngành liên quan về chỉ đạo kiểm tra, kiểm định nghiêm ngặt các thiết bị đo lường trong sản xuất, phân phối và chất lượng sản phẩm NLSH trước khi đưa ra thị trường. Chính phủ cần có cơ chế, chính sách ưu đãi đối với thuế của sản phẩm NLSH theo từng giai đoạn của lộ trình, các quy định về thuế đối với nguyên liên sản xuất NLSH. Có chính sách khuyến khích đầu tư đối với các dự án sản xuất nguyên liệu, phối trộn, phân phối NLSH đảm bảo thực hiện lộ trình xăng E5 và chống gian lận thương mại…\n MINH TRÍ \n","crawl":1396951400128,"crawler":"news-1y-v1","htmlenc":"true","img_urls":[{"description":"","url":"http://www.nhandan.org.vn/media/k2/items/cache/2284/692b500931ee57588e91bfd1179ed439_L.jpg"},{"description":"","url":"http://www.nhandan.org.vn/images/qngai2.JPG"}],"isoLanguageCode":"vn","media":"news","pub":1396941960000,"region":"vn","source_url":"Nhân dân","tags":["ethanol","xăng","xăng sinh học","Quảng Ngãi","Tập đoàn dầu khí quốc gia Việt Nam","nhiên liệu","lộ trình","sinh học","Bộ Công Thương","pha chế","phân phối","Bình Sơn","Bù Đăng","Bình Phước","mạng lưới phân phối"],"title":"Bộ Công thương triển khai thực hiện lộ trình phối trộn và sử dụng xăng sinh học","url":"http://www.baomoi.com/Bo-Cong-thuong-trien-khai-thuc-hien-lo-trinh-phoi-tron-va-su-dung-xang-sinh-hoc/50/13513511.epi","valid":"true"}
